{
  "schemaVersion": "1.0.0",
  "repository": "nathanmcnulty/azd-reference",
  "sourceRevision": "a09cac311aac7362f56d2a31833ed90ce5812649",
  "capturedAt": "2026-10-07",
  "items": [
    {
      "id": "REF-001",
      "title": "Reconcile this backlog with current source and active work",
      "kind": "discovery",
      "priority": "P1",
      "status": "done",
      "wave": 0,
      "problem": "Plans and implementation evidence are spread across files; the captured source can change while other tasks work.",
      "scope": [
        "docs/backlog.json",
        "docs/backlog.md",
        "Existing roadmap, execution status, open issues and pull requests (read-only)"
      ],
      "acceptance": [
        "Classify each candidate as implemented, still open, superseded or awaiting evidence; retain source links and reasons.",
        "Inspect dirty state, remotes, worktrees and local environment presence without reading secrets; avoid duplicate work with active owners.",
        "Resolve the actual offline validation commands and record exact current default-branch/working-tree provenance; do not copy historical live passes to newer code."
      ],
      "validation": [
        "git status --short",
        "git remote -v",
        "git worktree list --porcelain",
        "Read the applicable instructions and validation workflow; read gh issue list and gh pr list for the named repository using nathanmcnulty. Do not create or modify issues/PRs."
      ],
      "dependencies": [],
      "authorization": "local-only",
      "components": [],
      "sources": [
        "README.md"
      ],
      "evidence": [
        "2026-10-04 reconciliation against current main 54a29a590c8b015f5becf7457407128e1b413835: read-only issue/PR inventory found issues #2/#3/#4/#65 closed and no open PRs. REF-003/006/008 retain bounded completed evidence; REF-002 CI pilot, REF-004 Flex qualification, REF-005 permission/extraction metadata and REF-007 separately owned security components remain proposed.",
        "Inspected status, remotes, worktrees and environment-directory presence without reading secrets. Preserved active permission/component owner branches and all current-main governance/catalog changes; selected only 17 owned backlog/registry paths plus fixture-local signing guards in PortfolioStatus and PortfolioUpdate (19 paths total).",
        "Resolved current .github/workflows/validate.yml commands. Syntax/PSScriptAnalyzer, component-version and skeleton drift/WhatIf, catalog 11 tests/build, Bicep compiled positive/negative assertions, 30-root/202-record backlog validation and generated Markdown check passed locally. Historical live passes remain bound to their original runtime files; no new deployment or release is claimed."
      ],
      "blocker": null
    },
    {
      "id": "REF-002",
      "title": "Pilot the shared backlog contract in repository validation",
      "kind": "maintenance",
      "priority": "P1",
      "status": "done",
      "wave": 1,
      "problem": "Backlog files need structural and dependency checks before agents can reliably select work.",
      "scope": [
        "standards/agent-backlogs.md",
        "schemas/backlog.schema.json",
        "tooling/Test-AzdBacklog.ps1",
        "tooling/Export-AzdBacklogMarkdown.ps1",
        ".github/workflows/validate.yml"
      ],
      "acceptance": [
        "Schema rejects missing acceptance, duplicate IDs, invalid states and unknown authorization classes.",
        "Semantic checks reject local/cross-repository cycles, unresolved dependency references, ready tasks with unmet dependencies, done without evidence, and claims without ownership.",
        "Markdown freshness check runs locally and can be added to normal CI after review; no required-check or catalog enforcement change."
      ],
      "validation": [
        "Use the offline commands in the registered validation workflow; record the exact commands, revision and results before implementation is complete.",
        "Run focused tests for changed behavior from tests/; fixtures do not prove live-service or endpoint behavior."
      ],
      "dependencies": [],
      "authorization": "local-only",
      "components": [],
      "sources": [
        "README.md",
        ".github/workflows/validate.yml"
      ],
      "evidence": [
        "Selected for this local reconciliation under the maintainer instruction to finish work not requiring judgment. The existing schema/semantic tools and ten regression tests enforce the bounded task contract and dependency/evidence/ownership checks.",
        "Added an ordinary step to the existing Windows/Linux validation job: Test-AzdBacklog.ps1 and Export-AzdBacklogMarkdown.ps1 -Check. Both commands pass locally against the current repository; this adds no required check, catalog enforcement, runtime dependency, deployment or tenant action. Hosted validation is verified through the PR before main integration."
      ],
      "blocker": null,
      "claim": null
    },
    {
      "id": "REF-003",
      "title": "Provide a read-only portfolio backlog report and local wave selector",
      "kind": "feature",
      "priority": "P1",
      "status": "done",
      "wave": 1,
      "problem": "The maintainer needs one aggregate view without maintaining a second copy of every task.",
      "scope": [
        "tooling/Get-AzdBacklogStatus.ps1",
        "tests/Backlog.Tests.ps1",
        "docs/portfolio-backlog.md"
      ],
      "acceptance": [
        "Aggregate declared repository-local backlogs into ordered rows by priority, wave, status, authorization and component task references; keep owning JSON as the only task database.",
        "ReadyOnly returns only ready/local-only tasks after validation of the full dependency set; PowerShell filtering selects waves without claims, scheduling or issue writes.",
        "Missing input paths, unresolved IDs, duplicate identities and invalid dependency states fail validation; source freshness is reviewed by the executing agent from recorded snapshot provenance."
      ],
      "validation": [
        "Invoke-Pester ./tests/Backlog.Tests.ps1 -CI",
        "Pass the complete declared backlog paths to tooling/Test-AzdBacklog.ps1 and tooling/Get-AzdBacklogStatus.ps1; compare aggregate and ReadyOnly counts with canonical JSON."
      ],
      "dependencies": [],
      "authorization": "local-only",
      "components": [],
      "sources": [
        "tooling/Get-AzdBacklogStatus.ps1",
        "tests/Backlog.Tests.ps1",
        "docs/portfolio-backlog.md"
      ],
      "evidence": [
        "2026-10-03 local validation of the new tooling: 31 declared backlog roots resolved; initial 175-row aggregate matched all canonical records; ReadyOnly returned 35 ready/local-only reconciliation tasks.",
        "Invoke-Pester tests/Backlog.Tests.ps1: 10 passed, 0 failed. Full PSScriptAnalyzer across the three new tools: no findings. No new hosted-CI run or release is claimed."
      ],
      "blocker": null
    },
    {
      "id": "REF-004",
      "title": "Qualify identity-only Flex host storage before widening adoption",
      "kind": "discovery",
      "priority": "P1",
      "status": "proposed",
      "wave": 1,
      "problem": "The Flex host is a pilot; its existing storage credential boundary should be compared with identity-only consumers before reuse.",
      "scope": [
        "components/bicep/flex-scheduled-poller-host/",
        "tests/",
        "docs/component-candidates.md"
      ],
      "acceptance": [
        "Document exact host/deployment/checkpoint identity and RBAC boundaries; preserve portable solution-owned state and delivery.",
        "Pilot changes with at least two real consumer shapes; no runtime fetches or forced Log Analytics.",
        "Publish a reviewed immutable version only under separate release authorization; drifted consumer files are never overwritten."
      ],
      "validation": [
        "Use the offline commands in the registered validation workflow; record the exact commands, revision and results before implementation is complete.",
        "Run focused tests for changed behavior from tests/; fixtures do not prove live-service or endpoint behavior."
      ],
      "dependencies": [],
      "authorization": "local-only",
      "components": [
        "flex-scheduled-poller-host"
      ],
      "sources": [
        "docs/component-candidates.md",
        "components/bicep/flex-scheduled-poller-host/component.json"
      ],
      "evidence": [
        "2026-10-11 source-only pilot0.2.0 adds opt-in identityOnlyStorage with compatibility defaultfalse, host Blob Data Owner scoped to the shared account, SystemAssignedIdentity deployment, actual service endpoint host settings and identity-only reserved-name filtering. Exact PIM4c6ddfdb1cc0d5f30c9cac817a259decd181cc31 and riskf8eda4504566e0521204fd884fd630c3a9910d24 wrapper/lock shapes preserve naming, settings, aliases, state and7/14day retention. Compiled two-shape assertions,13 security negatives,72 actual compiled predicate cases and default resource/settings parity are offline evidence only. Incremental ARM conditions do not delete existing roles: adoption/rollback need separately reviewed exact role inventory/reconciliation, and fresh-shape proofs do not establish in-place migration. Full registered validation and independent review remain separate evidence gates; no tag, consumer adoption, native package/runtime/checkpoint or effective grant claim. REF-004 remains proposed with original acceptance and separate live/release gates preserved."
      ],
      "blocker": null
    },
    {
      "id": "REF-005",
      "title": "Reconcile component candidates and permission-aware feature metadata",
      "kind": "maintenance",
      "priority": "P2",
      "status": "done",
      "wave": 1,